{
  "$schema": "https://json-schema.org/draft/2020-12/schema",
  "$id": "notes.v3",
  "title": "One live notebook update: 90 s of lecture as study-guide drafts (topic final_notes, NOTEBOOK_DESIGN §11.4)",
  "type": "object",
  "required": ["schema", "video_id", "update_index", "media_start", "media_end", "window_starts", "transcript",
               "elements", "info", "generator", "created_ts"],
  "additionalProperties": false,
  "properties": {
    "schema": {"const": "notes.v3"},
    "video_id": {"type": "string", "pattern": "^[A-Za-z0-9_.-]{1,64}$"},
    "update_index": {"type": "integer", "minimum": 0,
                     "description": "floor(media_start / NOTE_UPDATE_S), or the next free index for a late window"},
    "media_start": {"type": "number", "minimum": 0, "description": "media seconds covered by this update"},
    "media_end": {"type": "number", "minimum": 0},
    "window_starts": {"type": "array", "minItems": 1, "items": {"type": "integer", "minimum": 0}},
    "transcript": {
      "type": "array",
      "description": "the transcript the elements were checked against; consolidation and a rebuild read it from here",
      "items": {
        "type": "object",
        "required": ["chunk_id", "start_time", "end_time", "text"],
        "additionalProperties": false,
        "properties": {
          "chunk_id": {"type": "integer", "minimum": 0},
          "start_time": {"type": "number", "minimum": 0},
          "end_time": {"type": "number", "minimum": 0},
          "text": {"type": "string"}
        }
      }
    },
    "elements": {
      "type": "array",
      "maxItems": 2,
      "items": {
        "allOf": [{"$ref": "#/$defs/element"}],
        "required": ["id", "extends"],
        "properties": {
          "id": {"type": "string", "pattern": "^u[0-9]+e[0-9]+$", "description": "u<update>e<seq>, assigned by code"},
          "extends": {"type": ["string", "null"], "pattern": "^u[0-9]+e[0-9]+$",
                      "description": "a paragraph continuing an earlier live paragraph: its id"}
        },
        "unevaluatedProperties": false
      }
    },
    "info": {
      "type": ["object", "null"],
      "description": "course logistics heard in this update, kept out of the notes",
      "required": ["text", "t"],
      "additionalProperties": false,
      "properties": {"text": {"type": "string", "minLength": 1, "maxLength": 200}, "t": {"type": "number", "minimum": 0}}
    },
    "generator": {"enum": ["llm", "extractive"]},
    "model": {"type": ["string", "null"]},
    "agent_ms": {"type": "number", "minimum": 0},
    "quality_flags": {"type": "array", "items": {"type": "string"}},
    "session_start": {"type": "integer", "minimum": 0},
    "created_ts": {"type": "integer", "minimum": 0}
  },
  "$defs": {
    "element": {
      "type": "object",
      "description": "a study-guide element (NOTEBOOK_DESIGN §11.1); identical in consolidation.v1",
      "required": ["kind", "t", "said"],
      "properties": {
        "kind": {"enum": ["para", "example", "steps", "table", "code", "remember"]},
        "t": {"type": "number", "minimum": 0, "description": "media seconds of the chunk where it was said"},
        "said": {"type": "string", "maxLength": 400, "description": "the transcript at that place (shown on hover)"},
        "lead": {"type": "string", "maxLength": 60},
        "title": {"type": "string", "maxLength": 80},
        "caption": {"type": "string", "maxLength": 120},
        "text": {"type": "string", "minLength": 1, "maxLength": 240},
        "sentences": {"type": "array", "maxItems": 12, "items": {"type": "string", "minLength": 1, "maxLength": 400}},
        "terms": {
          "type": "array",
          "items": {
            "type": "object",
            "required": ["term", "definition"],
            "additionalProperties": false,
            "properties": {"term": {"type": "string", "minLength": 1, "maxLength": 60},
                           "definition": {"type": "string", "minLength": 1, "maxLength": 400}}
          }
        },
        "background": {"type": ["string", "null"], "maxLength": 300},
        "steps": {"type": "array", "maxItems": 8, "items": {"type": "string", "minLength": 1, "maxLength": 220}},
        "items": {"type": "array", "minItems": 2, "maxItems": 8, "items": {"type": "string", "minLength": 1, "maxLength": 220}},
        "code": {"type": ["string", "null"], "maxLength": 800},
        "columns": {"type": "array", "minItems": 2, "maxItems": 3, "items": {"type": "string", "maxLength": 40}},
        "rows": {"type": "array", "minItems": 1, "maxItems": 6,
                 "items": {"type": "array", "items": {"type": "string", "maxLength": 140}}}
      },
      "allOf": [
        {"if": {"properties": {"kind": {"const": "para"}}},
         "then": {"required": ["lead", "sentences", "terms", "background"], "properties": {"sentences": {"minItems": 1}}}},
        {"if": {"properties": {"kind": {"const": "example"}}}, "then": {"required": ["title", "sentences", "steps", "code"]}},
        {"if": {"properties": {"kind": {"const": "steps"}}}, "then": {"required": ["lead", "items"]}},
        {"if": {"properties": {"kind": {"const": "table"}}}, "then": {"required": ["caption", "columns", "rows"]}},
        {"if": {"properties": {"kind": {"const": "code"}}},
         "then": {"required": ["caption", "code"], "properties": {"code": {"type": "string", "minLength": 1}}}},
        {"if": {"properties": {"kind": {"const": "remember"}}}, "then": {"required": ["text"]}}
      ]
    }
  }
}
